{"$schema":"../schemas/block.schema.json","name":"password-criteria","description":"Use this block to show a password input together with live password requirement validation and visual valid or invalid states.","keywords":["password","password criteria","requirements","validation","security","form"],"preview":"react-blocks/dist/ix/password-criteria","variants":{"angular":{"files":[{"path":"angular/password-criteria.ts"},{"path":"angular/password-criteria.html"},{"path":"angular/password-criteria.css"}],"dependencies":[{"name":"@siemens/ix","version":"^5.2.1"},{"name":"@siemens/ix-angular","version":"^5.2.1"},{"name":"@siemens/ix-icons","version":"^3.5.0"}]},"react":{"files":[{"path":"react/password-criteria.tsx"},{"path":"react/password-criteria.module.css"}],"dependencies":[{"name":"@siemens/ix","version":"^5.2.1"},{"name":"@siemens/ix-icons","version":"^3.5.0"},{"name":"@siemens/ix-react","version":"^5.2.1"}]}}}